{
  "version": 1,
  "architecture": "amd64",
  "provenance": {
    "installedInventory": {
      "format": "dpkg-query-status-tsv-v1",
      "sha256": "261feac824fcb8414b48fd5d62150d304c0f7906488ff39aaa10bd3c2236791b",
      "installedRecords": 1353
    },
    "solverResult": {
      "format": "apt-get-simulate-v1",
      "sha256": "71139de84e966336cb6fee12d740a85b57475c56f6e2e6a46b44abbc206ad680",
      "changes": [
        {
          "action": "upgrade",
          "name": "chrony",
          "previousVersion": "4.6.1-3+deb13u1",
          "version": "4.6.1-3+deb13u2"
        },
        {
          "action": "upgrade",
          "name": "curl",
          "previousVersion": "8.14.1-2+deb13u3",
          "version": "8.14.1-2+deb13u4"
        },
        {
          "action": "upgrade",
          "name": "libcurl3t64-gnutls:amd64",
          "previousVersion": "8.14.1-2+deb13u3",
          "version": "8.14.1-2+deb13u4"
        },
        {
          "action": "upgrade",
          "name": "libcurl4t64:amd64",
          "previousVersion": "8.14.1-2+deb13u3",
          "version": "8.14.1-2+deb13u4"
        }
      ]
    }
  },
  "packages": [
    {
      "name": "aardvark-dns",
      "version": "1.14.0-3"
    },
    {
      "name": "acl",
      "version": "2.3.2-2+b1"
    },
    {
      "name": "adduser",
      "version": "3.152"
    },
    {
      "name": "adwaita-icon-theme",
      "version": "48.1-1"
    },
    {
      "name": "apparmor",
      "version": "4.1.1-pmx1"
    },
    {
      "name": "appstream",
      "version": "1.0.5-1"
    },
    {
      "name": "apt",
      "version": "3.0.3"
    },
    {
      "name": "apt-listchanges",
      "version": "4.8"
    },
    {
      "name": "apt-utils",
      "version": "3.0.3"
    },
    {
      "name": "at-spi2-common",
      "version": "2.56.2-1+deb13u1"
    },
    {
      "name": "at-spi2-core",
      "version": "2.56.2-1+deb13u1"
    },
    {
      "name": "attr",
      "version": "1:2.5.2-3"
    },
    {
      "name": "autoconf",
      "version": "2.72-3.1"
    },
    {
      "name": "automake",
      "version": "1:1.17-4"
    },
    {
      "name": "autopoint",
      "version": "0.23.1-2"
    },
    {
      "name": "autotools-dev",
      "version": "20240727.1"
    },
    {
      "name": "base-files",
      "version": "13.8+deb13u5"
    },
    {
      "name": "base-passwd",
      "version": "3.6.7"
    },
    {
      "name": "bash",
      "version": "5.2.37-2+b9"
    },
    {
      "name": "bash-completion",
      "version": "1:2.16.0-7"
    },
    {
      "name": "bc",
      "version": "1.07.1-4"
    },
    {
      "name": "bind9-dnsutils",
      "version": "1:9.20.23-1~deb13u1"
    },
    {
      "name": "bind9-host",
      "version": "1:9.20.23-1~deb13u1"
    },
    {
      "name": "bind9-libs:amd64",
      "version": "1:9.20.23-1~deb13u1"
    },
    {
      "name": "binutils",
      "version": "2.44-3"
    },
    {
      "name": "binutils-common:amd64",
      "version": "2.44-3"
    },
    {
      "name": "binutils-x86-64-linux-gnu",
      "version": "2.44-3"
    },
    {
      "name": "bridge-utils",
      "version": "1.7.1-4+b1"
    },
    {
      "name": "bsd-mailx",
      "version": "8.1.2-0.20220412cvs-1.1"
    },
    {
      "name": "bsdextrautils",
      "version": "2.41-5"
    },
    {
      "name": "bsdutils",
      "version": "1:2.41-5"
    },
    {
      "name": "btrfs-progs",
      "version": "6.14-1"
    },
    {
      "name": "busybox",
      "version": "1:1.37.0-6+b8"
    },
    {
      "name": "bzip2",
      "version": "1.0.8-6"
    },
    {
      "name": "bzip2-doc",
      "version": "1.0.8-6"
    },
    {
      "name": "ca-certificates",
      "version": "20250419"
    },
    {
      "name": "ceph-common",
      "version": "19.2.3-pve4"
    },
    {
      "name": "ceph-fuse",
      "version": "19.2.3-pve4"
    },
    {
      "name": "chrony",
      "version": "4.6.1-3+deb13u2"
    },
    {
      "name": "cifs-utils",
      "version": "2:7.4-1"
    },
    {
      "name": "cmake-data",
      "version": "3.31.6-2"
    },
    {
      "name": "conntrack",
      "version": "1:1.4.8-2"
    },
    {
      "name": "console-setup",
      "version": "1.242~deb13u1"
    },
    {
      "name": "console-setup-linux",
      "version": "1.242~deb13u1"
    },
    {
      "name": "containernetworking-plugins",
      "version": "1.1.1+ds1-3+b17"
    },
    {
      "name": "coreutils",
      "version": "9.7-3"
    },
    {
      "name": "corosync",
      "version": "3.1.10-pve2"
    },
    {
      "name": "cpio",
      "version": "2.15+dfsg-2"
    },
    {
      "name": "cpp",
      "version": "4:14.2.0-1"
    },
    {
      "name": "cpp-12",
      "version": "12.4.0-5"
    },
    {
      "name": "cpp-14",
      "version": "14.2.0-19"
    },
    {
      "name": "cpp-14-x86-64-linux-gnu",
      "version": "14.2.0-19"
    },
    {
      "name": "cpp-x86-64-linux-gnu",
      "version": "4:14.2.0-1"
    },
    {
      "name": "criu",
      "version": "4.1.1-1"
    },
    {
      "name": "cron",
      "version": "3.0pl1-197"
    },
    {
      "name": "cron-daemon-common",
      "version": "3.0pl1-197"
    },
    {
      "name": "cstream",
      "version": "4.0.0-1"
    },
    {
      "name": "curl",
      "version": "8.14.1-2+deb13u4"
    },
    {
      "name": "dash",
      "version": "0.5.12-12"
    },
    {
      "name": "dbus",
      "version": "1.16.2-2"
    },
    {
      "name": "dbus-bin",
      "version": "1.16.2-2"
    },
    {
      "name": "dbus-daemon",
      "version": "1.16.2-2"
    },
    {
      "name": "dbus-session-bus-common",
      "version": "1.16.2-2"
    },
    {
      "name": "dbus-system-bus-common",
      "version": "1.16.2-2"
    },
    {
      "name": "dbus-user-session",
      "version": "1.16.2-2"
    },
    {
      "name": "dconf-gsettings-backend:amd64",
      "version": "0.40.0-5"
    },
    {
      "name": "dconf-service",
      "version": "0.40.0-5"
    },
    {
      "name": "dctrl-tools",
      "version": "2.24-3+b1"
    },
    {
      "name": "debconf",
      "version": "1.5.91"
    },
    {
      "name": "debconf-i18n",
      "version": "1.5.91"
    },
    {
      "name": "debhelper",
      "version": "13.24.2"
    },
    {
      "name": "debian-archive-keyring",
      "version": "2025.1"
    },
    {
      "name": "debian-keyring",
      "version": "2025.07.26"
    },
    {
      "name": "debian-tag2upload-keyring",
      "version": "1.1"
    },
    {
      "name": "debianutils",
      "version": "5.23.2"
    },
    {
      "name": "dh-autoreconf",
      "version": "20"
    },
    {
      "name": "dh-strip-nondeterminism",
      "version": "1.14.1-2"
    },
    {
      "name": "diffstat",
      "version": "1.67-1"
    },
    {
      "name": "diffutils",
      "version": "1:3.10-4"
    },
    {
      "name": "dirmngr",
      "version": "2.4.7-21+deb13u1+b3"
    },
    {
      "name": "distro-info-data",
      "version": "0.66+deb13u2"
    },
    {
      "name": "dmeventd",
      "version": "2:1.02.205-2+pmx1"
    },
    {
      "name": "dmidecode",
      "version": "3.6-2"
    },
    {
      "name": "dmsetup",
      "version": "2:1.02.205-2+pmx1"
    },
    {
      "name": "dosfstools",
      "version": "4.2-1.2"
    },
    {
      "name": "dpkg",
      "version": "1.22.22"
    },
    {
      "name": "dpkg-dev",
      "version": "1.22.22"
    },
    {
      "name": "dput",
      "version": "1.2.4"
    },
    {
      "name": "dracut-install",
      "version": "106-6"
    },
    {
      "name": "dtach",
      "version": "0.9-7"
    },
    {
      "name": "dwz",
      "version": "0.15-1+b1"
    },
    {
      "name": "e2fsprogs",
      "version": "1.47.2-3+b11"
    },
    {
      "name": "ebtables",
      "version": "2.0.11-6"
    },
    {
      "name": "efibootmgr",
      "version": "18-2"
    },
    {
      "name": "eject",
      "version": "2.41-5"
    },
    {
      "name": "equivs",
      "version": "2.3.2"
    },
    {
      "name": "ethtool",
      "version": "1:6.14.2-1"
    },
    {
      "name": "fakeroot",
      "version": "1.37.1.1-1"
    },
    {
      "name": "faketime",
      "version": "0.9.10+2024-06-05+gba9ed5b2-0.6"
    },
    {
      "name": "fdisk",
      "version": "2.41-5"
    },
    {
      "name": "fdutils",
      "version": "5.6-4+b1"
    },
    {
      "name": "file",
      "version": "1:5.46-5"
    },
    {
      "name": "findutils",
      "version": "4.10.0-3"
    },
    {
      "name": "fish-common",
      "version": "4.0.2-1"
    },
    {
      "name": "fontconfig",
      "version": "2.15.0-2.3"
    },
    {
      "name": "fontconfig-config",
      "version": "2.15.0-2.3"
    },
    {
      "name": "fonts-dejavu-core",
      "version": "2.37-8"
    },
    {
      "name": "fonts-dejavu-mono",
      "version": "2.37-8"
    },
    {
      "name": "fonts-droid-fallback",
      "version": "1:8.1.0r7-1~1.gbp36536b"
    },
    {
      "name": "fonts-font-awesome",
      "version": "5.0.10+really4.7.0~dfsg-4.1"
    },
    {
      "name": "fonts-font-logos",
      "version": "1.0.1-3"
    },
    {
      "name": "fonts-glyphicons-halflings",
      "version": "1.009~3.4.1+dfsg-6"
    },
    {
      "name": "fonts-noto-mono",
      "version": "20201225-2"
    },
    {
      "name": "fonts-urw-base35",
      "version": "20200910-8"
    },
    {
      "name": "frr",
      "version": "10.6.1-1+pve2"
    },
    {
      "name": "frr-pythontools",
      "version": "10.6.1-1+pve2"
    },
    {
      "name": "fuse",
      "version": "3.17.2-3"
    },
    {
      "name": "fuse3",
      "version": "3.17.2-3"
    },
    {
      "name": "g++",
      "version": "4:14.2.0-1"
    },
    {
      "name": "g++-14",
      "version": "14.2.0-19"
    },
    {
      "name": "g++-14-x86-64-linux-gnu",
      "version": "14.2.0-19"
    },
    {
      "name": "g++-x86-64-linux-gnu",
      "version": "4:14.2.0-1"
    },
    {
      "name": "gcc",
      "version": "4:14.2.0-1"
    },
    {
      "name": "gcc-12",